{
  "$schema": "http://json-schema.org/draft-07/schema#",
  "$id": "https://github.com/gtrabanco/agentic-workflow/packages/agentic-workflow-schema/envelope.schema.json",
  "title": "agentic-workflow machine envelope v2",
  "description": "The strict v2 machine envelope emitted by workflow-status and accepted by compatibility-aware drivers. Source of truth: @gtrabanco/agentic-workflow-schema.",
  "type": "object",
  "additionalProperties": false,
  "required": [
    "skill",
    "state",
    "summary",
    "unit",
    "phase",
    "pr",
    "gates",
    "findings",
    "blockers",
    "dependencies",
    "recommendations",
    "needs_input",
    "next",
    "detail"
  ],
  "properties": {
    "skill": { "type": "string", "minLength": 1 },
    "state": {
      "enum": [
        "OK",
        "CONTINUE",
        "READY_FOR_REVIEW",
        "READY_FOR_AUDIT",
        "MERGE_READY",
        "MERGED",
        "NEEDS_FIXES",
        "BLOCKED",
        "NEEDS_INPUT",
        "FAILED",
        "HALT"
      ]
    },
    "summary": { "type": "string" },
    "unit": {
      "type": "object",
      "additionalProperties": false,
      "required": ["type", "id", "issue", "branch"],
      "properties": {
        "type": { "enum": ["feature", "fix", "docs", "none"] },
        "id": { "type": ["string", "null"] },
        "issue": { "type": ["integer", "null"] },
        "branch": { "type": ["string", "null"] }
      }
    },
    "phase": {
      "type": "object",
      "additionalProperties": false,
      "required": ["current", "total", "completed"],
      "properties": {
        "current": { "type": ["string", "null"] },
        "total": { "type": ["integer", "null"] },
        "completed": { "type": ["integer", "null"] }
      }
    },
    "pr": {
      "type": "object",
      "additionalProperties": false,
      "required": ["number", "url", "state", "head_sha", "merge_ready", "ci"],
      "properties": {
        "number": { "type": ["integer", "null"] },
        "url": { "type": ["string", "null"] },
        "state": { "enum": ["open", "merged", "none"] },
        "head_sha": { "type": ["string", "null"] },
        "merge_ready": { "type": ["boolean", "null"] },
        "ci": { "enum": ["green", "red", "pending", "none", null] }
      }
    },
    "gates": {
      "type": "object",
      "additionalProperties": false,
      "required": ["verification", "review_pending", "audit_pending"],
      "properties": {
        "verification": { "enum": ["green", "red", "not-run", null] },
        "review_pending": { "type": ["boolean", "null"] },
        "audit_pending": { "type": ["boolean", "null"] }
      }
    },
    "findings": {
      "type": "object",
      "additionalProperties": false,
      "required": ["fix_now", "issues_filed", "untriaged", "decisions_recorded"],
      "properties": {
        "fix_now": {
          "type": "array",
          "items": {
            "type": "object",
            "additionalProperties": false,
            "required": ["id", "file", "axis", "severity", "class", "route", "suggested_tier"],
            "properties": {
              "id": { "type": "string" },
              "file": { "type": "string" },
              "axis": { "type": "string" },
              "severity": { "enum": ["high", "med", "low"] },
              "class": { "type": "string" },
              "route": { "type": "string" },
              "suggested_tier": { "enum": ["strong", "cheap"] }
            }
          }
        },
        "issues_filed": { "type": "array", "items": { "type": "integer" } },
        "untriaged": { "type": "integer", "minimum": 0 },
        "decisions_recorded": { "type": "integer", "minimum": 0 }
      }
    },
    "blockers": {
      "type": "array",
      "items": {
        "type": "object",
        "additionalProperties": false,
        "required": ["kind", "id", "scope", "detail"],
        "properties": {
          "kind": {
            "enum": ["dependency", "issue", "gate", "merge-conflict", "substrate", "input"]
          },
          "id": { "type": "string" },
          "scope": { "enum": ["unit", "run"] },
          "detail": { "type": "string" }
        }
      }
    },
    "dependencies": {
      "type": "object",
      "additionalProperties": false,
      "required": ["unmet", "build_order"],
      "properties": {
        "unmet": { "type": "array", "items": { "type": "string" } },
        "build_order": { "type": "array", "items": { "type": "string" } }
      }
    },
    "recommendations": {
      "type": "object",
      "additionalProperties": false,
      "required": ["product_audit", "reason"],
      "properties": {
        "product_audit": { "type": "boolean" },
        "reason": { "type": ["string", "null"] }
      }
    },
    "needs_input": {
      "oneOf": [
        { "type": "null" },
        {
          "type": "object",
          "additionalProperties": false,
          "required": ["question", "options"],
          "properties": {
            "question": { "type": "string" },
            "options": { "type": "array", "items": { "type": "string" } }
          }
        }
      ]
    },
    "next": {
      "type": "object",
      "additionalProperties": false,
      "required": ["recommended", "alternatives", "tier"],
      "properties": {
        "recommended": { "type": "string" },
        "alternatives": { "type": "array", "items": { "type": "string" } },
        "tier": { "enum": ["strong", "cheap"] },
        "suggested": {
          "type": "array",
          "items": {
            "type": "object",
            "additionalProperties": false,
            "required": ["command", "trigger", "source_skill"],
            "properties": {
              "command": { "type": "string" },
              "trigger": { "type": "string" },
              "source_skill": { "type": "string" }
            }
          }
        },
        "continuation": {
          "type": "object",
          "additionalProperties": false,
          "required": ["argv", "preconditions", "convergence"],
          "properties": {
            "argv": {
              "type": "array",
              "minItems": 1,
              "items": { "type": "string", "minLength": 1 }
            },
            "rendering": { "type": "string", "minLength": 1 },
            "preconditions": {
              "type": "array",
              "items": {
                "type": "object",
                "additionalProperties": false,
                "required": ["id", "check", "satisfied"],
                "properties": {
                  "id": { "type": "string", "minLength": 1 },
                  "check": { "type": "string", "minLength": 1 },
                  "satisfied": { "type": "boolean" }
                }
              }
            },
            "evidence": {
              "type": "object",
              "additionalProperties": false,
              "required": ["artifact", "digest"],
              "properties": {
                "artifact": { "type": "string", "minLength": 1 },
                "digest": { "type": "string", "pattern": "^[0-9a-f]{64}$" }
              }
            },
            "convergence": { "type": "string", "minLength": 1 }
          }
        }
      }
    },
    "detail": {}
  }
}
